question,answers,id
what to do in new orleans with kids?,"[""Belle of the Nineties""]",2670
what countries did queen elizabeth i rule?,"[""England""]",2671
what channel is the mtv vma awards on?,"[""MTV""]",2672
what kind of currency does jamaica use?,"[""Jamaican dollar""]",2673
what type of government does the nigeria have?,"[""Presidential system"", ""Federal republic"", ""Federation""]",2674
where is usc from?,"[""United States of America"", ""California"", ""Los Angeles""]",2675
what country was william shakespeare born?,"[""United Kingdom""]",2676
where do they grow rice in italy?,"[""Lombardy""]",2677
where great britain on the world map?,"[""Europe""]",2678
what to see in dallas tx?,"[""Meadows Museum"", ""Texas Theatre"", ""Dallas Convention Center"", ""Dallas Zoo"", ""Dallas Holocaust Museum/Center for Education & Tolerance"", ""George W. Bush Presidential Center"", ""Sixth Floor Museum"", ""The Trammell & Margaret Crow Collection of Asian Art"", ""Dallas World Aquarium"", ""Dallas Arboretum and Botanical Garden""]",2679
what is my timezone in california?,"[""Pacific Time Zone""]",2680
what is president abraham lincoln known for?,"[""President of the United States""]",2681
who did cristina yang's husband cheated on her with?,"[""Preston Burke""]",2682
who does jemaine clement play in despicable me?,"[""Jerry the Minion""]",2683
what year did the vietnam war happen?,"[""1960s""]",2684
where do the broncos play?,"[""Sports Authority Field at Mile High""]",2685
who inspired antonio vivaldi?,"[""Johann Sebastian Bach""]",2686
what type of currency is used in puerto rico?,"[""United States dollar""]",2687
what is jackie kennedy famous for?,"[""First Lady of the United States""]",2688
what currency is used in france before euro?,"[""French franc"", ""Assignat""]",2689
who started up mcdonalds?,"[""Ray Kroc""]",2690
what major landforms are located in egypt?,"[""Sahara"", ""Libyan Desert""]",2691
who played nba finals 2010?,"[""Los Angeles Lakers""]",2692
what does the devil look like in young goodman brown?,"[""The Old Man""]",2693
what state was ronald reagan governor of?,"[""California""]",2694
what is the most practiced religion in the united states?,"[""Christianity""]",2695
where was my honda motorcycle made?,"[""Tokyo""]",2696
what did isaac newton discovered as a mathematician?,"[""isaac newton co-developed calculus with gottfried wilhelm leibniz""]",2697
what is st james palace?,"[""Palace""]",2698
what airport to fly into to get to clearwater florida?,"[""Clearwater Air Park""]",2699
who has britney spears married?,"[""Jason Allen Alexander"", ""Kevin Federline""]",2700
what currency is used in hungary?,"[""Hungarian forint""]",2701
what currency do they use in qatar?,"[""Qatari riyal""]",2702
what are fun things to do in denver colorado?,"[""Black American West Museum & Heritage Center"", ""Denver Firefighters Museum"", ""Colorado State Capitol"", ""Denver Mint"", ""Molly Brown House"", ""Forney Transportation Museum"", ""Denver Botanic Gardens"", ""Museum of Contemporary Art Denver"", ""Denver Museum of Nature and Science"", ""Chamberlin Observatory""]",2703
what did thoreau die from?,"[""Tuberculosis""]",2704
how much does the average american pay in taxes over their lifetime?,"[""American National Biography"", ""47 Percenters and Guerrilla Decontextualization (Part 1): Dreams and Nightmares"", ""Why Race Mattered in Barack Obama's Re-election""]",2705
what do the symbols in the illinois flag represent?,"[""State Sovereignty, National Union""]",2706
what years did the red sox win the world series?,"[""1918 World Series"", ""2007 World Series"", ""2004 World Series"", ""1903 World Series"", ""1912 World Series"", ""1916 World Series"", ""1915 World Series""]",2707
what war was woodrow wilson president for?,"[""World War I""]",2708
who is carl edwards racing for?,"[""Roush Fenway Racing""]",2709
what to do in panama city beach in february?,"[""Thunder Beach Motorcycle Rally"", ""Club La Vela"", ""Man in the Sea Museum"", ""Camp Helen State Park"", ""Pier Park"", ""Shipwreck Island"", ""Latimer Cabin"", ""St. Andrews State Park"", ""Miracle Strip at Pier Park""]",2710
where are the florida marlins from?,"[""Sun Life Stadium"", ""Marlins Park""]",2711
what is the main religion in eastern europe?,"[""Zift""]",2712
what language does romanian people speak?,"[""Hungarian language"", ""Torlakian"", ""Romanian Language"", ""Romani language"", ""Ukrainian Language""]",2713
what date was john adams elected president?,"[""John Adams Presidential Campaign, 1796""]",2714
who nominated stephen g. breyer?,"[""Bill Clinton""]",2715
what contribution did maurice wilkins make to dna?,"[""Albert Lasker Award for Basic Medical Research""]",2716
what did george w bush do before becoming president?,"[""Governor of Texas""]",2717
which party was lincoln?,"[""Illinois Republican Party"", ""Republican Party"", ""National Union Party"", ""Whig Party""]",2718
who are the two current illinois senators?,"[""Dick Durbin""]",2719
what did robin gibb died from?,"[""Pneumonia"", ""Liver cancer"", ""Colorectal cancer""]",2720
what college did joe montana play for?,"[""Notre Dame Fighting Irish football""]",2721
what were adolf hitler's parents names?,"[""Alois Hitler"", ""Klara Hitler""]",2722
what did jordyn wieber win gold for?,"[""Gymnastics at the 2012 Summer Olympics – Women's artistic team all-around""]",2723
what job does bill rancic have?,"[""Entrepreneur"", ""Businessperson"", ""Writer"", ""Television Producer"", ""Author""]",2724
what did robert hooke discover?,"[""Based on his design, a marine chronometer accurate enough to measure longitude was eventually constructed by John Harrison in the 18th century.""]",2725
what does michael jackson like to eat?,"[""Vegetarian food""]",2726
who owns the new england patriots football team?,"[""Robert Kraft""]",2727
where do the japanese live?,"[""Japan""]",2728
what is the dollar called in brazil?,"[""Brazilian real""]",2729
what airport fly into for maui?,"[""Hana Airport""]",2730
what has lucy hale played in?,"[""A Cinderella Story: Once Upon A Song"", ""10 Years"", ""Sorority Wars"", ""The Sisterhood of the Traveling Pants 2"", ""Scream 4"", ""Fear Island"", ""Tinker Bell: Secret of the Wings"", ""Killer in the Family""]",2731
who won 2011 heisman trophy?,"[""Robert Griffin III""]",2732
who is the falcons kicker?,"[""Matt Bryant""]",2733
where did charles drew go to high school?,"[""Dunbar High School""]",2734
what language do argentina use?,"[""Yiddish Language"", ""Italian Language"", ""Spanish Language""]",2735
who won governor race in indiana?,"[""Mitch Daniels""]",2736
what languages do people speak in egypt?,"[""Egyptian language"", ""Akkadian language"", ""Hittite language""]",2737
what college did florence griffith joyner attend?,"[""David Starr Jordan High School"", ""University of California, Los Angeles"", ""California State University, Northridge""]",2738
what style of art did henri matisse use?,"[""Fauvism"", ""Impressionism"", ""Neo-impressionism"", ""Modernism""]",2739
what did george washington carver make with peanuts?,"[""Peanut butter""]",2740
who plays alan parrish in jumanji?,"[""Robin Williams""]",2741
who was reese witherspoon married too?,"[""Ryan Phillippe"", ""Jim Toth""]",2742
what is the isthmus of panama?,"[""Panama Canal Zone""]",2743
who is the coach of the la lakers?,"[""Mike D'Antoni""]",2744
what is the dominican republic's capital?,"[""Santo Domingo""]",2745
what is illinois state flower called?,"[""Viola""]",2746
what books did mark twain read?,"[""George MacDonald"", ""Charles Dickens"", ""Plutarch"", ""Thomas Malory"", ""William Dean Howells"", ""Thomas Paine"", ""Miguel de Cervantes"", ""Robert Browning""]",2747
who plays miley cyrus brother?,"[""Guitarist""]",2748
what language do they speak thailand?,"[""Mon Language"", ""Lao Language"", ""Khmer language"", ""Hmong language"", ""Thai Language"", ""Cham language"", ""Mlabri language"", ""Malay, Pattani Language"", ""Nyaw Language"", ""Saek language""]",2749
what are the major religions in poland?,"[""Catholicism"", ""Ukrainian Greek Catholic Church""]",2750
what is the san francisco giants mascot?,"[""Crazy Crab"", ""Lou Seal""]",2751
where was tupac born?,"[""East Harlem""]",2752
where is the main headquarters of the un?,"[""New York City""]",2753
what utc time zone is arizona?,"[""Mountain Time Zone"", ""UTC−07:00""]",2754
who played as barney?,"[""David Joyner""]",2755
who played elaine's boyfriend on seinfeld?,"[""Jerry Seinfeld""]",2756
who did juan ponce de leon married?,"[""Leonor de León""]",2757
what language do they speak in spain wikipedia?,"[""Spanish Language""]",2758
where to watch live opening ceremony in london?,"[""2012 Summer Olympics""]",2759
what times is it in texas?,"[""Mountain Time Zone"", ""Central Time Zone"", ""UTC−07:00"", ""UTC−06:00""]",2760
where did the arizona diamondbacks play?,"[""Chase Field""]",2761
what did fred davis do?,"[""American football player""]",2762
what country was theodor schwann born in?,"[""Germany""]",2763
where is the fukushima daiichi located?,"[""Japan"", ""Okuma""]",2764
what country was bin laden from?,"[""Saudi Arabia""]",2765
who plays claudia joy on army wives?,"[""Kim Delaney""]",2766
where did darfur happen?,"[""Sudan""]",2767
what language does greece use?,"[""Greek Language""]",2768
what kind of money does argentina use?,"[""Argentine peso""]",2769
who was the prime minister of australia in 1958?,"[""Robert Menzies""]",2770
what hemisphere south america?,"[""Northern Hemisphere"", ""Southern Hemisphere""]",2771
what movies has taylor momsen been in?,"[""Underdog"", ""Paranoid Park"", ""Spy Kids 2: Island of Lost Dreams"", ""How the Grinch Stole Christmas!"", ""We Were Soldiers"", ""Hansel and Gretel"", ""Spy School"", ""Saving Shiloh"", ""10 Years""]",2772
what show was kim richards in as a child?,"[""Nanny and the Professor""]",2773
what was henry ford best known for?,"[""Industrialist""]",2774
what kind of music did michael jackson sing?,"[""Soul music"", ""Pop music"", ""New jack swing"", ""Dance music"", ""Disco"", ""Dance-pop"", ""Rock music"", ""Rhythm and blues"", ""Motown Sound"", ""Funk""]",2775
what education does jeff corwin have?,"[""Norwell High School"", ""Bridgewater State College"", ""University of Massachusetts Amherst""]",2776
what movies has chris colfer been in?,"[""8"", ""Russel Fish: The Sausage and Eggs Incident"", ""Glee Encore"", ""Struck by Lightning"", ""Glee: The 3D Concert Movie""]",2777
where the queen of denmark lives?,"[""Copenhagen""]",2778
what did roald dahl write?,"[""Danny, the Champion of the World"", ""Willy Wonka & the Chocolate Factory"", ""The Witches"", ""The BFG"", ""Charlie and the Chocolate Factory"", ""Fantastic Mr. Fox"", ""36 Hours"", ""James and the Giant Peach"", ""Matilda""]",2779
who was the real erin brockovich?,"[""Environmentalist"", ""Paralegal""]",2780
where are riddell helmets manufactured?,"[""New York City""]",2781
what county is troy il in?,"[""Madison County""]",2782
what position does mitt romney hold?,"[""Governor of Massachusetts""]",2783
who is country singer jewel married to?,"[""Ty Murray""]",2784
what movies does tupac act in?,"[""Murder Was the Case"", ""Above the Rim"", ""Bullet"", ""Gang Related"", ""Watch Juice"", ""Tupac: Live at the House of Blues"", ""Nothing but Trouble"", ""Juice"", ""Poetic Justice"", ""Gridlock'd""]",2785
what famous book did adam smith wrote?,"[""The Wealth of Nations""]",2786
where does the appalachian trail run through?,"[""Eastern United States""]",2787
where is burundi located on a map?,"[""Africa""]",2788
what year did mcfly go to the future?,"[""6th March 2006""]",2789
what unicef stands for?,"[""United Nations Children's Fund""]",2790
what clubs has messi played for?,"[""Argentina national football team"", ""FC Barcelona"", ""FC Barcelona C"", ""FC Barcelona B""]",2791
where is merrell shoes headquarters?,"[""Rockford""]",2792
who does the uk trade with?,"[""Canada"", ""Angola"", ""Anguilla"", ""United States of America"", ""Sierra Leone""]",2793
what color are the baltimore ravens?,"[""Purple"", ""White"", ""Black"", ""Gold""]",2794
what country volvo cars made?,"[""Sweden""]",2795
who plays karen jackson on shameless?,"[""Rebecca Atkinson""]",2796
what is tim tebow's religion?,"[""Christianity""]",2797
what country is singapore next to?,"[""Eurasia"", ""Southeast Asia"", ""Asia""]",2798
what year did detroit pistons win the championship?,"[""1990 NBA Finals"", ""2004 NBA Finals"", ""1989 NBA Finals""]",2799
what does anderson cooper do?,"[""Journalist""]",2800
what movies did matt bomer play in?,"[""Magic Mike"", ""Flightplan"", ""Winter's Tale"", ""In Time"", ""8"", ""The Normal Heart"", ""The Texas Chainsaw Massacre: The Beginning""]",2801
who is ellen bernstein?,"[""Actor""]",2802
when are the australian open men's finals?,"[""Yearly""]",2803
when was reagan inaugurated?,"[""1/20/1981""]",2804
where did dmitri mendeleev teach?,"[""Saint Petersburg State Institute of Technology""]",2805
what kind of education did barack obama have?,"[""Occidental College"", ""Harvard Law School"", ""Noelani Elementary School"", ""Punahou School"", ""State Elementary School Menteng 01"", ""St. Francis of Assisi Catholic School"", ""Columbia University""]",2806
what was the last time the pittsburgh pirates had a winning season?,"[""1979 World Series"", ""1971 World Series"", ""1960 World Series"", ""1909 World Series"", ""1925 World Series""]",2807
what did james k polk believe in?,"[""Presbyterianism"", ""Methodism""]",2808
what currency does south africa have?,"[""South African rand""]",2809
where did jerome david salinger died?,"[""Cornish""]",2810
what religions are recognized in canada?,"[""Protestantism"", ""Catholicism"", ""Islam""]",2811
what airport is closest to cancun?,"[""Cancún International Airport""]",2812
where is somalia located?,"[""Africa""]",2813
who played lex luthor in the original superman?,"[""Gene Hackman""]",2814
who is the head coach of the chicago blackhawks?,"[""Joel Quenneville""]",2815
where was john f kennedy raised?,"[""Boston"", ""Massachusetts"", ""Washington, D.C.""]",2816
what does kat dennings star in?,"[""The Scream Team"", ""The Answer Man"", ""Raise Your Voice"", ""Charlie Bartlett"", ""Shorts"", ""The 40-Year-Old Virgin"", ""Down in the Valley"", ""Nick and Norah's Infinite Playlist"", ""The House Bunny"", ""Big Momma's House 2""]",2817
what did henry kissinger do?,"[""United States Secretary of State"", ""National Security Advisor""]",2818
where does volga river start?,"[""Valdai Hills""]",2819
what are the major sports played in venezuela?,"[""Venezuela women's national volleyball team"", ""Venezuela national football team"", ""Venezuela men's national volleyball team""]",2820
what did roger sherman do for a living?,"[""Senator"", ""Member of Congress""]",2821
who does ryan newman race for?,"[""Alltel""]",2822
what was the political system in libya?,"[""Provisional government"", ""Parliamentary republic""]",2823
who plays the voice of lois griffin on family guy?,"[""Alex Borstein""]",2824
who did alicia keys have a baby with?,"[""Swizz Beatz""]",2825
what the currency in argentina?,"[""Argentine peso""]",2826
where does eddie bravo teach?,"[""Brazilian jiu-jitsu""]",2827
when did michael schumacher win his first title?,"[""1995""]",2828
where does sally pearson live?,"[""Gold Coast""]",2829
what college chris paul go to?,"[""Wake Forest University""]",2830
where is madeira?,"[""Atlantic Ocean"", ""Azores Canaries Madeira"", ""Madeira Islands archipelago"", ""Portugal""]",2831
what country is joseph prince from?,"[""Singapore""]",2832
when did democritus discovered the atom?,"[""6129 Demokritos""]",2833
what do they speak in austria?,"[""Austrian German"", ""Bosnian language"", ""Hungarian language"", ""Croatian language"", ""Serbian language"", ""Bavarian Language"", ""Slovenian language"", ""German Language"", ""Turkish Language""]",2834
what are major religions in the united states?,"[""Unitarian Universalism"", ""Judaism"", ""Christianity"", ""Atheism"", ""Buddhism"", ""Hinduism"", ""Islam""]",2835
what things did thomas edison invent?,"[""Phonograph"", ""Carbon microphone"", ""Mimeograph"", ""Quadruplex telegraph"", ""Electric power distribution"", ""Movie camera"", ""Incandescent light bulb"", ""Phonograph cylinder""]",2836
where is the sistine chapel by michelangelo?,"[""Rome""]",2837
who has played edward quartermaine on general hospital?,"[""David Lewis""]",2838
what is the zip code for iselin nj?,"[""08830""]",2839
what kind of language does switzerland speak?,"[""Romansh language"", ""French Language"", ""German Language"", ""Italian Language""]",2840
where is christina aguilera from?,"[""Staten Island""]",2841
what are fun things to do in philadelphia?,"[""Philadelphia Zoo"", ""Wagner Free Institute of Science"", ""African American Museum in Philadelphia"", ""Liberty Bell"", ""Rodin Museum"", ""Independence Hall"", ""Boathouse Row"", ""Academy of Natural Sciences"", ""Reading Terminal Market"", ""Franklin Institute""]",2842
who does david carr play for?,"[""San Francisco 49ers"", ""Carolina Panthers"", ""New York Giants"", ""Houston Texans"", ""Fresno State Bulldogs football""]",2843
where did jackie robinson go to school?,"[""University of California, Los Angeles"", ""Pasadena City College"", ""John Muir High School""]",2844
where is jack daniel buried?,"[""Lynchburg""]",2845
what strings does john mayer?,"[""guitar""]",2846
who plays stacey in zoey 101?,"[""Lacey Turner""]",2847
when did sanchez leave usc?,"[""2009 NFL season""]",2848
who is steven seagal sister?,"[""Brenda Seagal""]",2849
where was f scott fitzgerald education?,"[""St. Paul Academy and Summit School"", ""Nardin Academy"", ""Princeton University""]",2850
on what continent is canada found?,"[""North America""]",2851
what is the primary language of israel?,"[""Hebrew Language"", ""Arabic Language""]",2852
who is married to jane krakowski?,"[""Robert Godley""]",2853
what role did tom cruise play in endless love?,"[""Billy""]",2854
where to go in phnom penh cambodia?,"[""Cambodia-Vietnam Friendship Monument"", ""Kingdom Breweries"", ""National Museum of Cambodia"", ""Wat Phnom"", ""Royal Palace, Phnom Penh"", ""Sisowath Quay"", ""Independence Monument, Phnom Penh"", ""Tuol Sleng Genocide Museum"", ""Choeung Ek"", ""Silver Pagoda, Phnom Penh""]",2855
what city was ronald reagan born in?,"[""Tampico""]",2856
what countries in the world speak arabic?,"[""Tunisia"", ""Eritrea"", ""Saudi Arabia"", ""Comoros""]",2857
what 4 states border the pacific ocean?,"[""Oregon""]",2858
what to do in nadi fiji?,"[""Garden of the Sleeping Giant"", ""Subar Maniya"", ""Yasawa"", ""Kula Eco Park"", ""Mamanuca Islands"", ""Nananu-i-Ra"", ""Koroyanitu National Park"", ""Navala Bures"", ""Denerau Beach"", ""Sri Siva Subramaniya temple""]",2859
who is francis bacon and what did he do?,"[""Spy"", ""Scientist"", ""Statesman"", ""Philosopher"", ""Author""]",2860
what is the dominant language of jamaica?,"[""Jamaican English""]",2861
when does medicare part d start?,"[""Centers for Medicare and Medicaid Services""]",2862
what is the postcode for seoul south korea?,"[""139-799""]",2863
what type of government does the bahamas have?,"[""Parliamentary system"", ""Unitary state"", ""Constitutional monarchy""]",2864
what university did tony romo go to?,"[""Eastern Illinois University""]",2865
where is bosnia?,"[""Europe"", ""Eurasia"", ""Balkans""]",2866
what countries speak german as a first language?,"[""Canada"", ""German Democratic Republic"", ""Luxembourg"", ""Switzerland"", ""Liechtenstein"", ""Germany"", ""West Germany"", ""Belgium"", ""Vatican City"", ""Second Polish Republic""]",2867
where is amazon based out of?,"[""Seattle""]",2868
what team did mike piazza retire with?,"[""New York Mets""]",2869
what is state animal of illinois?,"[""Northern Cardinal""]",2870
where did robert boyle study?,"[""Eton College"", ""University College, Oxford""]",2871
what is there to see near the grand canyon?,"[""Phoenix"", ""Grand Canyon National Park"", ""Lake Powell""]",2872
where does the fda get its authority?,"[""Commisioner of Food and Drugs""]",2873
where does hector camacho live?,"[""United States of America""]",2874
who was vladimir lenin and why was he important?,"[""Revolutionary"", ""Politician"", ""Economist"", ""Lawyer"", ""Philosopher""]",2875
what language do cyprus speak?,"[""Greek Language"", ""Turkish Language""]",2876
where does fabio aurelio play?,"[""Grêmio Foot-Ball Porto Alegrense"", ""Liverpool F.C.""]",2877
what war did george washington help win?,"[""American Revolutionary War""]",2878
where does danny ainge live?,"[""Wellesley"", ""Eugene""]",2879
what college did steve jobs attend?,"[""Reed College""]",2880
where was anne frank born?,"[""Frankfurt""]",2881
who plays young joe dirt?,"[""David Spade""]",2882
what company did verizon used to be?,"[""AT&T Corporation""]",2883
who was king tut's wife?,"[""Ankhesenamun""]",2884
what team did magic johnson play for?,"[""Los Angeles Lakers""]",2885
what are the kennedys?,"[""Rose Fitzgerald Kennedy"", ""Patrick Bouvier Kennedy"", ""John F. Kennedy"", ""Rosemary Kennedy"", ""Caroline Kennedy"", ""Kathleen Cavendish"", ""John F. Kennedy, Jr."", ""Joseph P. Kennedy, Sr."", ""Bobby Shriver"", ""Joseph P. Kennedy, Jr.""]",2886
where kurdish people come from?,"[""Asia""]",2887
where is sarajevo located?,"[""Federation of Bosnia and Herzegovina"", ""Bosnia and Herzegovina"", ""Sarajevo Canton""]",2888
what is the official language in china?,"[""Nepali Language"", ""Standard Tibetan"", ""Chinese language"", ""Zhuang languages"", ""Korean Language"", ""English Language"", ""Esperanto Language"", ""Mongolian language"", ""Portuguese Language"", ""Cantonese""]",2889
who does the voice of kitt in knight rider?,"[""William Daniels""]",2890
what teams are left in the nfl?,"[""New York Jets"", ""Carolina Panthers"", ""Denver Broncos"", ""Baltimore Ravens"", ""Detroit Lions"", ""Kansas City Chiefs"", ""Arizona Cardinals"", ""New York Giants"", ""Jacksonville Jaguars"", ""Oakland Raiders""]",2891
what art movement was pablo picasso part of?,"[""Cubism"", ""Analytic cubism"", ""African Period"", ""Picasso's Blue Period"", ""Italian modern and contemporary art"", ""Synthetic cubism"", ""Picasso's Rose Period""]",2892
what type of business is mitt romney in?,"[""Politician""]",2893
what language do they speak in egyptian?,"[""Sa'idi Arabic"", ""Domari Language"", ""Nobiin Language"", ""Bedawi Arabic"", ""Arabic Language"", ""Siwi Language"", ""Egyptian Arabic"", ""Arabic, Sudanese Spoken Language""]",2894
what are historical places in new york?,"[""Chelsea Art Museum"", ""Brooklyn Bridge"", ""Empire State Building"", ""The Broadway Theatre"", ""American Museum of Natural History"", ""Central Park"", ""St. Patrick's Cathedral"", ""Japan Society of New York"", ""FusionArts Museum"", ""American Folk Art Museum""]",2895
in what year did columbus sail to the new world?,"[""1492 Conquest of Paradise""]",2896
what countries are included in the continent of asia?,"[""Bahrain"", ""Afghanistan"", ""Bangladesh"", ""Bhutan"", ""Brunei"", ""Indonesia"", ""India"", ""Cambodia"", ""China"", ""Iraq""]",2897
who owns wikimedia foundation?,"[""Jimmy Wales""]",2898
what war was george washington president during?,"[""American Revolutionary War""]",2899
when did miami dolphins win super bowl?,"[""Super Bowl VII"", ""Super Bowl VIII""]",2900
what timezone is minnesota in?,"[""Central Time Zone""]",2901
which airport do ba fly to in oslo?,"[""Oslo Airport, Gardermoen"", ""Oslo Airport, Fornebu""]",2902
what is there for kids to do in miami?,"[""Wolfsonian-FIU"", ""Lowe Art Museum"", ""Holocaust Memorial of the Greater Miami Jewish Federation"", ""Miami Art Museum"", ""Frost Art Museum"", ""Coral Castle"", ""Jewish Museum of Florida"", ""Jungle Island"", ""Miami Seaquarium"", ""Venetian Pool""]",2903
what country columbus was born?,"[""Genoa""]",2904
where did lauren conrad live?,"[""San Francisco"", ""Los Angeles"", ""Laguna Beach""]",2905
what bella name her baby?,"[""Renesmee Carlie Cullen""]",2906
what is the houston rockets mascot?,"[""Clutch""]",2907
what is there fun to do in san diego?,"[""Hotel del Coronado"", ""Cabrillo National Monument"", ""San Diego Zoo Safari Park"", ""San Diego Zoo"", ""Mission San Diego de Alcalá"", ""Old Town San Diego State Historic Park"", ""Balboa Park"", ""Birch Aquarium"", ""Old Point Loma Lighthouse"", ""USS Midway""]",2908
what movies johnny depp is in?,"[""Benny & Joon"", ""Blow"", ""A Nightmare on Elm Street"", ""Arizona Dream"", ""Chocolat"", ""Dead Man"", ""Charlie and the Chocolate Factory"", ""Cry-Baby"", ""Public Enemies"", ""Corpse Bride""]",2909
where did matthias schleiden do his work?,"[""University of Tartu""]",2910
what countries did andy warhol work?,"[""United States of America""]",2911
what songs does katherine jenkins sing?,"[""O Holy Night"", ""Seguedilla"", ""Wales Victorious (Bread of Heaven 2003)"", ""Time to Say Goodbye"", ""O Sole Mio"", ""Habanera"", ""One Fine Day"", ""House of No Regrets"", ""Song to the Moon"", ""Caruso""]",2912
what is ryan seacrest famous for?,"[""Presenter""]",2913
what is the current leader of japan?,"[""Shinzō Abe""]",2914
how much indiana jones movies are there?,"[""Indiana Jones and the Raiders of the Lost Ark"", ""Disaster Movie"", ""Indiana Jones and the Last Crusade"", ""Indiana Jones and the Temple of Doom"", ""Indiana Jones and the Kingdom of the Crystal Skull""]",2915
what does george soros own?,"[""Open Society Foundations"", ""Soros Fund Management"", ""Open Society Initiative for Southern Africa"", ""Soros Foundations Network"", ""Central European University"", ""Stefan Batory Foundation"", ""Democracy Alliance"", ""MoveOn.org"", ""Drug Policy Alliance"", ""J Street""]",2916
what kind of money should i bring to dominican?,"[""Dominican peso""]",2917
