question,answers,id
what sport is popular in china?,"[""China PR national football team"", ""China men's national volleyball team"", ""China national futsal team"", ""China national baseball team"", ""China women's national basketball team"", ""Bayi Yiyang High-Tech District"", ""China women's national volleyball team"", ""China Fed Cup team"", ""China national cricket team"", ""China Davis Cup team""]",1859
what to do with kids in phx az?,"[""Grand Canyon"", ""Phoenix Mountain Preserve"", ""Phoenix Art Museum"", ""Desert Botanical Garden"", ""Heard Museum"", ""Musical Instrument Museum"", ""Arizona Science Center"", ""Ro Ho En"", ""Mesa Arts Center"", ""Pueblo Grande Ruin""]",1860
where does kirk cameron live now?,"[""Los Angeles""]",1861
what continent is greenland apart of?,"[""North America""]",1862
which books did john the apostle write?,"[""The Gospel According to John""]",1863
who made the ancient egyptian pyramids?,"[""Ancient Egypt""]",1864
which asian country has the biggest population?,"[""China""]",1865
where did the san diego chargers originate?,"[""Los Angeles Chargers""]",1866
who was the voice of nemo's dad?,"[""Albert Brooks""]",1867
what 4 countries are part of the united kingdom?,"[""Wales"", ""England"", ""Scotland"", ""Northern Ireland""]",1868
who was king george v father?,"[""Edward VII""]",1869
who won last year's nfl super bowl?,"[""Baltimore Ravens""]",1870
who played michael myers in halloween 4?,"[""George P. Wilbur""]",1871
what language do chinese?,"[""Chinese""]",1872
what did daniel tosh say that was so offensive?,"[""Daniel Tosh: Happy Thoughts""]",1873
what happened to nagasaki?,"[""Atomic bombings of Hiroshima and Nagasaki""]",1874
what language is spoken in basque?,"[""Basque""]",1875
what movies did james franco play in?,"[""Tristan & Isolde"", ""Pineapple Express"", ""The Great Raid"", ""Annapolis"", ""Whatever It Takes"", ""The Company"", ""An American Crime"", ""Spider-Man"", ""Spider-Man 2"", ""Spider-Man 3""]",1876
what does bob dylan sing?,"[""Like a Rolling Stone""]",1877
what year did john adams get elected president?,"[""4/21/1789""]",1878
what to do in palo alto ca with kids?,"[""Hoover Tower"", ""PARC"", ""Stanford Memorial Church"", ""Hewlett-Packard House and Garage"", ""Leland Stanford Junior University Museum of Art"", ""Iris & B. Gerald Cantor Center for Visual Arts"", ""Palo Alto Baylands Nature Preserve"", ""Arastradero Preserve"", ""Stanford Shopping Center"", ""Professorville""]",1879
what country did jacques cartier came from?,"[""France""]",1880
what disease did abe lincoln have?,"[""Marfan syndrome"", ""Smallpox"", ""Strabismus""]",1881
what are the holidays of islam?,"[""Eid al-Fitr"", ""Ramadan"", ""Eid al-Adha""]",1882
who did magellan sail for?,"[""Explorer""]",1883
where did irish people come from?,"[""Ireland""]",1884
what represents ghana?,"[""Flag of Ghana""]",1885
what to see in downtown asheville nc?,"[""Asheville Art Museum"", ""Folk Art Center"", ""Grove Park Inn"", ""Pisgah National Forest"", ""Bele Chere"", ""Biltmore Estate"", ""Chimney Rock State Park"", ""Thomas Wolfe House"", ""Carl Sandburg Home National Historic Site"", ""Smith-McDowell House""]",1886
where did carrie underwood live?,"[""Checotah""]",1887
what sports do canadians like?,"[""Canada women's national volleyball team""]",1888
when did carolina hurricanes win the cup?,"[""2006 Stanley Cup Finals""]",1889
who does jr smith play for 2012?,"[""New York Knicks""]",1890
who currently owns the steelers?,"[""Rooney family""]",1891
where was toni braxton born and raised?,"[""Severn""]",1892
who has dirk nowitzki played for?,"[""Dallas Mavericks""]",1893
what is the currency in the dominican republic called?,"[""Dominican peso""]",1894
where is shoreview mn?,"[""Ramsey County""]",1895
what did maria theresa rule?,"[""Bohemia"", ""Hungary""]",1896
what was jack london's education?,"[""University of California, Berkeley"", ""Oakland High School""]",1897
what club team does ronaldinho play for?,"[""Clube Atlético Mineiro""]",1898
which countries share borders with spain?,"[""Perejil Island"", ""Portugal"", ""France"", ""Andorra"", ""Morocco"", ""Gibraltar""]",1899
what is the official currency in france?,"[""CFP franc"", ""Euro""]",1900
what going on in afghanistan right now?,"[""Conflict in Afghanistan""]",1901
what state did roger sherman represent at the constitutional convention?,"[""Connecticut""]",1902
what type of money do japanese use?,"[""Japanese yen""]",1903
what county is bradenton fl located in?,"[""Manatee County""]",1904
what is molly ringwald in?,"[""Office Killer"", ""The Breakfast Club"", ""Sixteen Candles"", ""Fresh Horses"", ""Strike It Rich"", ""Betsy's Wedding"", ""Pretty in Pink"", ""Spacehunter: Adventures in the Forbidden Zone"", ""The Stand"", ""Tempest""]",1905
what movies has scarlett johansson played in?,"[""Girl with a Pearl Earring"", ""Fall"", ""A Good Woman"", ""A Love Song for Bobby Long"", ""Don Jon's Addiction"", ""Eight Legged Freaks"", ""Ghost World"", ""Captain America: The Winter Soldier"", ""An American Rhapsody""]",1906
what is the philadelphia church of god?,"[""Protestant Organizations""]",1907
where did david duke go to college?,"[""Interregional Academy of Personnel Management"", ""Louisiana State University""]",1908
where does bradley cooper live now?,"[""Philadelphia""]",1909
what mark zuckerberg?,"[""Facebook, Inc.""]",1910
what country did vasco da gama come from?,"[""Portugal""]",1911
what country do they speak farsi?,"[""Canada"", ""Afghanistan"", ""Iran"", ""Oman"", ""Uzbekistan"", ""Bahrain"", ""Iraq"", ""Tajikistan""]",1912
who did japan surrender to in ww2?,"[""Iwane Matsui""]",1913
where does luke skywalker live in star wars?,"[""Tatooine""]",1914
what basketball team does kris humphrey play for?,"[""Brooklyn Nets""]",1915
what is time zone in hawaii?,"[""Hawaii–Aleutian Time Zone""]",1916
what is john cena doing right now?,"[""Fast Cars and Superstars: The Gillette Young Guns Celebrity Race"", ""WWE Saturday Night's Main Event"", ""WWE RAW""]",1917
what are two countries in south america?,"[""Carrasco"", ""Chacaltaya"", ""Chile"", ""Pampas"", ""Amazon Basin"", ""French Guiana"", ""Peru"", ""Guyana"", ""Paraguay"", ""Bolivia""]",1918
where did kobe bryant attend high school?,"[""Lower Merion High School""]",1919
what did doctor kevorkian do?,"[""Physician"", ""Pathologist""]",1920
where is chowchilla located?,"[""United States of America"", ""California"", ""Madera County""]",1921
what country is vatican city in?,"[""Rome""]",1922
who played princess leia's mother in star wars?,"[""Padmé Amidala""]",1923
what type of voting system does the uk have?,"[""Government of the United Kingdom""]",1924
where is the warmest weather in the united states in december?,"[""Florida""]",1925
where donald trump went to college?,"[""The Kew-Forest School"", ""University of Pennsylvania"", ""Fordham University"", ""Wharton School of the University of Pennsylvania"", ""New York Military Academy""]",1926
what did john howard study at university?,"[""Bachelor of Laws""]",1927
what did duke ellington do?,"[""Musician""]",1928
from which university did president obama receive his bachelor's degree?,"[""University of Chicago""]",1929
what year did yankees win their first world series?,"[""1923 World Series""]",1930
when was the last time the new england patriots won the superbowl?,"[""Super Bowl XXXVIII""]",1931
what films has morgan freeman narrated?,"[""A Raisin in the Sun""]",1932
where are the atlanta falcons located?,"[""Atlanta""]",1933
what is st francis patron saint of?,"[""All Creatures Of Our God And King""]",1934
where was obama born?,"[""Hawaii""]",1935
where was tommy emmanuel born?,"[""Muswellbrook""]",1936
what techniques did frida kahlo use in her paintings?,"[""Surrealism""]",1937
who does larry david play in seinfeld?,"[""Screenwriter""]",1938
what type of government does israel?,"[""Parliamentary system"", ""Democracy""]",1939
what political experience did abraham lincoln have?,"[""United States Representative"", ""President of the United States"", ""Member of Illinois House of Representatives""]",1940
where does brian williams live?,"[""Ridgewood""]",1941
where is downtown littleton?,"[""Arapahoe County""]",1942
what did shawnee smith star in?,"[""The Grudge 3"", ""Saw IV"", ""Summer School"", ""Saw II"", ""Saw III"", ""The Island"", ""Saw"", ""The Blob"", ""Who's Harry Crumb?""]",1943
what division is cincinnati bengals in?,"[""AFC North""]",1944
what technique did vincent van gogh use in his paintings?,"[""Post-Impressionism""]",1945
where was toussaint charbonneau from?,"[""Boucherville""]",1946
what countries include western europe?,"[""Kingdom of Great Britain"", ""French First Republic"", ""Austria"", ""Luxembourg"", ""British Isles"", ""Liechtenstein"", ""Western Roman Empire"", ""West Germany"", ""Monaco"", ""Switzerland""]",1947
what timezone is new mexico currently in?,"[""Mountain Time Zone"", ""UTC−07:00""]",1948
who is the current president of china 2010?,"[""Hu Jintao""]",1949
what is the legislature of missouri called?,"[""Missouri General Assembly""]",1950
what did harriet beecher stowe do as an abolitionist?,"[""Novelist"", ""Writer"", ""Author""]",1951
in which province is pretoria?,"[""Gauteng""]",1952
what college did jerry rice attend?,"[""Mississippi Valley State University""]",1953
who is liz lemon marrying on 30 rock?,"[""Jack Donaghy""]",1954
where was the battle of appomattox located?,"[""Appomattox Court House""]",1955
what country did john cabot sail for?,"[""Italy""]",1956
when did mt st helens first erupt?,"[""1980 eruption of Mount St. Helens""]",1957
where did the name rome come from?,"[""Romulus and Remus""]",1958
what time zone is fresno ca?,"[""Pacific Time Zone""]",1959
who was the governor of missouri in 1996?,"[""Mel Carnahan""]",1960
what was the cause of death for sage stallone?,"[""Myocardial infarction"", ""Atherosclerosis""]",1961
where did queen isabella live?,"[""Madrigal de las Altas Torres""]",1962
who played carl fredricksen in up?,"[""Ed Asner""]",1963
where did robert pattinson go to acting school?,"[""The Harrodian School""]",1964
what language does the country italy speak?,"[""Italian Language""]",1965
who won the super bowl xliv 2010?,"[""New Orleans Saints""]",1966
what events caused roosevelt to become more of an internationalist?,"[""1932 Democratic National Convention""]",1967
what do the colors on mali's flag represent?,"[""Flag of Mali""]",1968
when does school start in los angeles california 2011?,"[""August""]",1969
what years did the yankees win the championship?,"[""1941 World Series"", ""1939 World Series"", ""1932 World Series"", ""1928 World Series"", ""1936 World Series"", ""1923 World Series"", ""1927 World Series"", ""1937 World Series"", ""1938 World Series"", ""1943 World Series""]",1970
what did samuel de champlain?,"[""Soldier"", ""Sailor"", ""Navigator""]",1971
what was william faulkner known for?,"[""Background to Danger"", ""Flesh"", ""The Big Sleep"", ""The Long, Hot Summer"", ""To Have and Have Not"", ""Land of the Pharaohs"", ""Mildred Pierce"", ""Submarine Patrol"", ""Gunga Din"", ""Drums Along the Mohawk""]",1972
what language did the miwok indians speak?,"[""Utian languages""]",1973
who was audrey hepburn's husbands?,"[""Robert Wolders"", ""Andrea Dotti"", ""Mel Ferrer""]",1974
who were queen elizabeth 1 parents?,"[""Anne Boleyn"", ""Henry VIII of England""]",1975
what do you want from me jerrod niemann lyrics meaning?,"[""Universal Music Group Nashville"", ""Arista Nashville"", ""Category 5 Records""]",1976
what did robert koch do?,"[""Physician""]",1977
who does cristiano ronaldo play for?,"[""Real Madrid C.F.""]",1978
what currency is best to take to dominican republic?,"[""Dominican peso""]",1979
who's betty white?,"[""Singer"", ""Television Producer"", ""Author"", ""Actor"", ""TV Personality"", ""Comedian""]",1980
what has been discovered on mars so far?,"[""Acidalia Colles"", ""Aganippe Fossa"", ""Acheron Fossae"", ""Alba Patera"", ""Adirondack"", ""Aeolis Mensae"", ""Airy-0"", ""Airy"", ""Aeolis quadrangle"", ""Acidalia Planitia""]",1981
who is lleyton hewitt?,"[""Tennis player""]",1982
what movies did quentin tarantino star in?,"[""Grindhouse"", ""The Cutting Edge: The Magic of Movie Editing"", ""Sukiyaki Western Django"", ""Full Tilt Boogie"", ""Z Channel: A Magnificent Obsession"", ""BaadAsssss Cinema"", ""Desperado"", ""Four Rooms"", ""From Dusk till Dawn"", ""Dead On: The Life and Cinema of George A. Romero""]",1983
what language does the new zealand speak?,"[""Esperanto Language"", ""English Language"", ""Māori language"", ""Samoan Language"", ""Tongan Language"", ""Standard Mandarin"", ""Fijian Language""]",1984
what kind of cancer killed larry hagman have?,"[""Head and neck cancer"", ""Cancer"", ""Leukemia""]",1985
what kind of drugs does charlie sheen do?,"[""Cocaine""]",1986
who is clint eastwood dating?,"[""Dina Eastwood""]",1987
what county is sacramento located in?,"[""Sacramento County""]",1988
what did audrey hepburn died of?,"[""Appendix cancer""]",1989
what country was the treaty of versailles written?,"[""France""]",1990
what is st mary mascot?,"[""Griffin""]",1991
who was irving berlin and what did he do?,"[""Songwriter"", ""Lyricist"", ""Composer""]",1992
who shot j lennon?,"[""Mark David Chapman""]",1993
what happened during william henry harrison presidency?,"[""Battle of Tippecanoe""]",1994
where is the denver broncos stadium located?,"[""Sports Authority Field at Mile High""]",1995
where did sir ernest shackleton live?,"[""County Kildare""]",1996
what type of music is scott joplin?,"[""Piano"", ""Jazz piano""]",1997
where did the welsh language originate from?,"[""Celts""]",1998
who does leia think her father is?,"[""Bail Organa""]",1999
what languages do people speak in switzerland?,"[""Romansh language"", ""French Language"", ""German Language"", ""Italian Language""]",2000
who is president of france?,"[""Nicolas Sarkozy""]",2001
who did alf's voice?,"[""Paul Fusco""]",2002
what was theodore roosevelt's political party?,"[""Republican Party"", ""Progressive Party""]",2003
what year were the cincinnati reds founded?,"[""1881""]",2004
where ulysses s grant go to school?,"[""United States Military Academy""]",2005
where is kia cars made?,"[""Seoul""]",2006
what magazine did edgar allan poe work for?,"[""The Stylus"", ""Graham's Magazine"", ""Broadway Journal"", ""Burton's Magazine""]",2007
where are sunbeam appliances made?,"[""Canada"", ""United States of America""]",2008
where did chickasaw indians live?,"[""Indigenous peoples of the Southeastern Woodlands""]",2009
what happened after anne frank died?,"[""perished"", ""Typhus""]",2010
what music did antonio vivaldi compose?,"[""Baroque music"", ""Classical music""]",2011
who plays batman in 2012?,"[""Christian Bale""]",2012
what is the timezone in vancouver?,"[""Pacific Time Zone""]",2013
what time is world cup soccer?,"[""Every 4 Years""]",2014
what county is stockton ca located in?,"[""San Joaquin County""]",2015
what did ronnie radke do?,"[""guitar"", ""Lead vocalist"", ""keyboard""]",2016
where does selena gomez live right now 2010?,"[""New York City""]",2017
who is the member of rajya sabha?,"[""Ch. Munawwar Hasan"", ""Anil Ambani"", ""Jaya Bhaduri Bachchan""]",2018
what form of government does czech republic have?,"[""Parliamentary republic""]",2019
who is the leader of syria now?,"[""Bashar al-Assad""]",2020
what was eli whitney education?,"[""Yale University"", ""Yale College""]",2021
what movies has renee zellweger been in?,"[""Bridget Jones's Diary""]",2022
what other writers influenced charles dickens?,"[""Tobias Smollett"", ""Washington Irving"", ""Miguel de Cervantes"", ""William Wordsworth"", ""Honoré de Balzac"", ""Henry Fielding"", ""Victor Hugo"", ""Sheridan Le Fanu"", ""William Shakespeare"", ""Laurence Sterne""]",2023
where jay z was raised?,"[""Brooklyn""]",2024
what two countries is the us at war with?,"[""War in Afghanistan""]",2025
where did the assyrian empire start?,"[""Middle East""]",2026
what currency does the dominican republic?,"[""Dominican peso""]",2027
what is daniel radcliffe name in the woman in black?,"[""Arthur Kipps""]",2028
what money do they use in thailand?,"[""Thai baht""]",2029
where was battle of verdun located?,"[""Verdun""]",2030
where does avril lavigne live now?,"[""Belleville"", ""Greater Napanee""]",2031
who plays stewie griffin's voice family guy?,"[""Seth MacFarlane""]",2032
what should i see in london england?,"[""Regent's Park"", ""Tower of London"", ""Buckingham Palace"", ""Palace of Westminster"", ""London Eye"", ""Tower Bridge"", ""Hyde Park"", ""Westminster Abbey"", ""St Paul's Cathedral"", ""Trafalgar Square""]",2033
what currency is used in england 2012?,"[""UK £""]",2034
what language do iraqi people speak?,"[""Mesopotamian Arabic"", ""Turkmen Language"", ""Mandaic language"", ""Hebrew Language"", ""Kurdish language"", ""Azerbaijani language"", ""Armenian Language"", ""South Azeri language"", ""American English""]",2035
where did paul rudd go to high school?,"[""Shawnee Mission West High School""]",2036
what gauge strings john mayer?,"[""Blues-rock""]",2037
what was abe lincoln shot with?,"[""Firearm""]",2038
what did regina hall play in?,"[""Scary Movie"", ""First Sunday"", ""Danika"", ""Paid in Full"", ""Disappearing Acts"", ""Malibu's Most Wanted"", ""Scary Movie 4"", ""King's Ransom"", ""Scary Movie 3"", ""Scary Movie 2""]",2039
who plays jacob black in twilight?,"[""Taylor Lautner""]",2040
what american penny is worth money?,"[""Cent""]",2041
what book did jacob riis wrote?,"[""How the other half lives""]",2042
what airport is close to scottsdale arizona?,"[""Scottsdale Airport""]",2043
who plays noah bennet?,"[""Jack Coleman""]",2044
when did the italian fascists came to power?,"[""World War II""]",2045
who won american idol 2006 season 5?,"[""Jordin Sparks""]",2046
what to see in vietnam in two weeks?,"[""Hanoi""]",2047
where do the chicago cubs play?,"[""Wrigley Field""]",2048
where did reagan die?,"[""Bel-Air""]",2049
when did ian thorpe become famous?,"[""2000 Summer Olympics""]",2050
what is the language used in indonesia?,"[""Javanese Language"", ""Malay Language"", ""Sunda Language"", ""English Language"", ""Bali Language"", ""Indonesian Language"", ""Batak Language"", ""Tobelo Language"", ""Dutch Language"", ""Madura Language""]",2051
what was irving langmuir famous for?,"[""Franklin Medal"", ""Perkin Medal"", ""Nobel Prize in Chemistry"", ""John Scott Legacy Medal and Premium""]",2052
what are the traditions in jamaica?,"[""Bobsleigh"", ""Track and field athletics"", ""Swimming""]",2053
what is the official language of china called?,"[""Standard Mandarin""]",2054
where did mitt romney go to elementary school?,"[""Cranbrook Schools""]",2055
where is the gulf of st lawrence river?,"[""Canada"", ""Québec"", ""United States of America"", ""Ohio""]",2056
what was the name of martin luther king jr parents?,"[""Martin Luther King, Sr."", ""Alberta Williams King""]",2057
what money does guatemala use?,"[""Guatemalan quetzal""]",2058
who was president when nelson rockefeller was vice president?,"[""Gerald Ford""]",2059
what year magic johnson retired?,"[""1991""]",2060
what kind of government does spain have now?,"[""Parliamentary system"", ""Unitary state"", ""Constitutional monarchy"", ""Multi-party system""]",2061
what did freud say about women?,"[""Anatomy is destiny.""]",2062
who plays young john winchester in supernatural?,"[""Jeffrey Dean Morgan""]",2063
who killed vincent chin film?,"[""Ronald Ebens"", ""Michael Nitz""]",2064
where is shakira from originally?,"[""Barranquilla""]",2065
what region is manchester england?,"[""North West England""]",2066
where was the gettysburg war located?,"[""Gettysburg""]",2067
what do people go to amsterdam for?,"[""Molen van Sloten Windmill"", ""Begijnhof Chapel"", ""Amsterdam Museum"", ""Oude Kerk"", ""Diamond Museum Amsterdam"", ""Sexmuseum"", ""De Gooyer Windmill"", ""Hash, Marihuana and Hemp Museum"", ""Rembrandt House Museum"", ""Jordaan""]",2068
who is the elected governor of california?,"[""Jerry Brown""]",2069
what language chile speak?,"[""Puquina Language"", ""Spanish Language""]",2070
what year did john glenn walk on the moon?,"[""1976 Democratic National Convention""]",2071
what currency to take to side turkey?,"[""Turkish lira""]",2072
who founded the new democratic party?,"[""James Madison"", ""Thomas Jefferson""]",2073
what were the causes of the russian revolution in 1917?,"[""World War I""]",2074
what team did john madden play football for?,"[""Philadelphia Eagles"", ""Oregon Ducks football"", ""Cal Poly Mustangs football""]",2075
what does julian clary do?,"[""Actor""]",2076
where does the potomac river flow into?,"[""Chesapeake Bay""]",2077
where is the olympic national park located?,"[""Washington""]",2078
when does the world cup occur?,"[""Every 4 Years""]",2079
what years the steelers won the super bowl?,"[""Super Bowl IX"", ""Super Bowl XLIII"", ""Super Bowl X"", ""Super Bowl XL"", ""Super Bowl XIV"", ""Super Bowl XIII""]",2080
what art movement was vincent van gogh apart of?,"[""Post-Impressionism""]",2081
where does danish language come from?,"[""Denmark"", ""Greenland""]",2082
what countries are in the baltic region?,"[""Latvia"", ""Lithuania"", ""Estonia""]",2083
what nation did hitler lead?,"[""Germany""]",2084
what time is in london heathrow?,"[""Air Transportation""]",2085
when were women allowed to go to the olympics?,"[""The complete book of the Winter Olympics""]",2086
what continent does the amazon river flow through?,"[""South America""]",2087
what is a city in belgium?,"[""City of Brussels""]",2088
who played elle greenaway?,"[""Lola Glaudini""]",2089
what secondary school did adolf hitler go to?,"[""Realschule""]",2090
who was andy williams second wife?,"[""Debbie Meyer""]",2091
where are you from in egyptian arabic?,"[""Egypt""]",2092
what did captain scott die of?,"[""Starvation""]",2093
where does the catholic church originated from?,"[""Paul the Apostle"", ""Saint Peter""]",2094
what city did elvis presley grew up in?,"[""Tupelo""]",2095
what continent is belize located in?,"[""Central America""]",2096
who was donald duck's girlfriend?,"[""Daisy Duck""]",2097
what party was winston churchill in politics?,"[""Conservative Party""]",2098
what 4 teams did wayne gretzky play for?,"[""Edmonton Oilers""]",2099
who was philip randolph?,"[""Trade unionist"", ""Social activist""]",2100
where are brembo brakes from?,"[""Bergamo""]",2101
what did taylor swift do at the vmas 2012?,"[""Grammy Award for Best Country Solo Performance""]",2102
who did russians descend from?,"[""East Slavs""]",2103
what to see and do in san diego california?,"[""San Diego Zoo Safari Park"", ""San Diego Zoo"", ""Cabrillo National Monument"", ""Hotel del Coronado"", ""Mission San Diego de Alcalá"", ""Old Town San Diego State Historic Park"", ""Balboa Park"", ""Birch Aquarium"", ""Old Point Loma Lighthouse"", ""USS Midway""]",2104
what is the zip code for clarksville tn?,"[""37043"", ""37042"", ""37041"", ""37040"", ""37044""]",2105
where's wayne state?,"[""Michigan"", ""United States of America"", ""Detroit""]",2106
what dialect do most chinese speak?,"[""Chinese""]",2107
who is the president of cuba in 2009?,"[""Fidel Castro""]",2108
who does avril lavigne play in over the hedge?,"[""Heather""]",2109
where is the university of alabama?,"[""Tuscaloosa"", ""Alabama"", ""United States of America""]",2110
where is the country of armenia?,"[""Turkey"", ""Georgia"", ""Azerbaijan""]",2111
who tom cruise been married to?,"[""Katie Holmes"", ""Nicole Kidman"", ""Mimi Rogers""]",2112
which country is gaza city located?,"[""Israel""]",2113
who is president of pakistan 2012?,"[""Asif Ali Zardari""]",2114
what country did james watt come from?,"[""Scotland""]",2115
what instrument did louis armstrong like to play?,"[""trumpet"", ""Cornet""]",2116
what is the currency in germany in 2010?,"[""Euro""]",2117
what types of government does china have?,"[""Premier of the People's Republic of China""]",2118
where is the boeing company?,"[""Seattle"", ""Chicago""]",2119
what does bill gates own?,"[""Bill Gates' house""]",2120
what organism did mendel use?,"[""He continued teaching part-time, and began his experiments with cross-breeding garden peas.""]",2121
what are the two houses in congress?,"[""United States House of Representatives"", ""United States Senate""]",2122
what team does ladainian tomlinson play 4?,"[""San Diego Chargers"", ""New York Jets""]",2123
what is the major language spoken in canada?,"[""French Language"", ""English Language""]",2124
what did camille grammer do for a living?,"[""Film Producer"", ""Model"", ""Actor""]",2125
what jamaican language called?,"[""Jamaican Creole English Language"", ""Jamaican English""]",2126
what planet was luke skywalker raised on?,"[""Tatooine""]",2127
who did georgia o'keeffe inspired?,"[""Arthur Dove""]",2128
who does brandon jacobs play for?,"[""San Francisco 49ers""]",2129
what is the government structure of germany?,"[""Constitutional republic"", ""Multi-party system"", ""Federal republic"", ""Democracy"", ""Parliamentary republic""]",2130
who was queen elizabeth the first's mother?,"[""Anne Boleyn""]",2131
who is the leader of the dominican republic 2011?,"[""Leonel Fernández""]",2132
where did the anglican church start?,"[""Archbishop of Canterbury""]",2133
who does obama look up to?,"[""Saul Alinsky"", ""Nipsey Russell""]",2134
where did william mckinley go to high school?,"[""Poland Seminary High School""]",2135
who played heath barkley?,"[""Lee Majors""]",2136
what year did baltimore ravens win the superbowl?,"[""2012""]",2137
what is the name of the money used in spain?,"[""Euro""]",2138
what did edward jenner do for a living?,"[""edward jenner catalogued specimens from captain james cook""]",2139
when did shawn johnson won the gold medal?,"[""2008 Summer Olympics""]",2140
