question,answers,id
where is the world series 2012 being played?,"[""The Gashouse Gang: How Dizzy Dean, Leo Durocher, Branch Rickey, Pepper Martin, and Their Colorful, Come-from-Behind Ball Club Won the World Series - and America's Heart - During the Great Depression""]",1079
what kind of language do irish speak?,"[""Irish"", ""Hiberno-English"", ""Scots Language"", ""English Language"", ""Shelta Language"", ""Ulster Scots dialects""]",1080
what cancer did audrey hepburn died of?,"[""Appendix cancer""]",1081
where does allen iverson live now?,"[""Hampton""]",1082
where was dwight howard born?,"[""Atlanta""]",1083
where do guyanese people live?,"[""Guyana""]",1084
what timezone is texas san antonio in?,"[""Central Time Zone""]",1085
where is alexandria located?,"[""Egypt""]",1086
who was the fascist dictator of germany?,"[""Hitler""]",1087
what is australian currency?,"[""Australian dollar""]",1088
what did michelle obama do?,"[""First Lady of the United States""]",1089
what team does chris humphrey play for?,"[""Motherwell F.C.""]",1090
where do most chinese live?,"[""China""]",1091
when did the raiders win the superbowl?,"[""Super Bowl XV""]",1092
where is the euro used?,"[""Italy"", ""Portugal"", ""Finland"", ""Luxembourg"", ""France"", ""Slovenia"", ""Austria"", ""Germany"", ""Greece"", ""Spain""]",1093
how rich is the roman catholic church?,"[""Catholicism""]",1094
what year is it going to be on the jewish calendar?,"[""Yiddish Language""]",1095
where did pixie lott go to school?,"[""Italia Conti Academy of Theatre Arts""]",1096
what date did we invade iraq?,"[""2003 invasion of Iraq""]",1097
what is the new orleans hornets new name?,"[""Charlotte Hornets""]",1098
what did darry look like?,"[""Male""]",1099
who is hugh hefner dating now in 2012?,"[""Crystal Harris""]",1100
what do the buddha believe in?,"[""Buddhism""]",1101
when did braves win the world series?,"[""1995 World Series""]",1102
what is the name of walt disney's son?,"[""Roy O. Disney""]",1103
what are some sights to see in rome?,"[""Sistine Chapel"", ""Piazza Navona"", ""Roman Forum"", ""Baths of Caracalla"", ""Castel Sant'Angelo"", ""Bocca della Verità"", ""Pantheon"", ""St. Peter's Basilica"", ""Raphael Rooms"", ""Colosseum""]",1104
where is jack daniels tennessee whiskey made?,"[""Tennessee""]",1105
what is the battle of antietam?,"[""Maryland Campaign"", ""American Civil War""]",1106
what time zone is it in london england?,"[""Greenwich Mean Time""]",1107
who was governor of texas in 2003?,"[""Rick Perry""]",1108
what is yale university mascot?,"[""Handsome Dan""]",1109
what is the currency used in tunisia?,"[""Tunisian dinar""]",1110
what language group does polish belong to?,"[""Lechitic languages""]",1111
what is the name of the new orleans saints football stadium?,"[""Mercedes-Benz Superdome""]",1112
what are five countries that border france?,"[""Italy"", ""Monaco"", ""Luxembourg"", ""Andorra"", ""Switzerland"", ""Germany"", ""Bay of Biscay"", ""Belgium"", ""Piedmont"", ""Spain""]",1113
where was hockey world cup 2010 held?,"[""The Cup""]",1114
where did kaiser wilhelm fled to?,"[""Doorn""]",1115
when did yuvraj made his odi debut?,"[""10/3/2000""]",1116
what type of music was scott joplin noted for?,"[""Ragtime""]",1117
where did sergio romo go to college?,"[""University of North Alabama""]",1118
what happened to peter parker's uncle?,"[""Marvel Comics""]",1119
where is adam smith from?,"[""Kirkcaldy""]",1120
who became president after harding died?,"[""Calvin Coolidge""]",1121
in what city did machiavelli live?,"[""Florence""]",1122
what illnesses did george washington have?,"[""Malaria"", ""Smallpox"", ""Tuberculosis""]",1123
where is north port florida located?,"[""Sarasota County"", ""United States of America"", ""Florida""]",1124
who is jennifer lawrence boyfriend 2012?,"[""Nicholas Hoult""]",1125
who was the voice of kitt?,"[""William Daniels""]",1126
who is the speaker of the house of representatives currently?,"[""Nancy Pelosi""]",1127
when did sean murray first appear on ncis?,"[""2003""]",1128
who is abraham maslow?,"[""Psychologist""]",1129
where did the cuban missile crisis happen?,"[""Cuba Island""]",1130
what is benedict arnold famous for?,"[""Traitor""]",1131
where is the original mona lisa?,"[""Louvre""]",1132
what is jill wagner on wipeout?,"[""Him/Herself""]",1133
what type of language does peru speak?,"[""Omagua Language"", ""Spanish Language"", ""Waorani Language"", ""Quechua"", ""Puquina Language"", ""Aymara language""]",1134
where is port lavaca tx?,"[""United States of America"", ""Texas"", ""Calhoun County""]",1135
which team does ronaldinho play for 2013?,"[""Brazil national football team""]",1136
what kind of books does nicholas sparks wrote?,"[""Das Lächeln der Sterne."", ""Weg Der Traume"", ""Three weeks with my brother"", ""Dear John"", ""A bend in the road"", ""Weg der Träume."", ""Une bouteille à la mer"", ""A Tout Jamais"", ""At first sight"", ""The Choice""]",1137
what happened to the people in chernobyl?,"[""Nuclear accident"", ""Industrial disaster""]",1138
what countries has spanish as their official language?,"[""Honduras"", ""Uruguay"", ""El Salvador"", ""Panama"", ""Equatorial Guinea"", ""Andorra"", ""Guatemala"", ""Puerto Rico"", ""Paraguay"", ""Belize""]",1139
who was the communist dictator of north korea?,"[""Kim Jong-il""]",1140
who was the leader of germany in wwii?,"[""Hitler""]",1141
what business does raj kundra do?,"[""Entrepreneur"", ""Businessperson"", ""Film Producer""]",1142
what movies is molly ringwald in?,"[""Office Killer"", ""The Breakfast Club"", ""Sixteen Candles"", ""Fresh Horses"", ""Strike It Rich"", ""Betsy's Wedding"", ""Pretty in Pink"", ""Spacehunter: Adventures in the Forbidden Zone"", ""The Stand"", ""Tempest""]",1143
what is the time zone in california called?,"[""Pacific Time Zone""]",1144
what team does drogba play for 2013?,"[""Galatasaray S.K.""]",1145
what did michael faraday accomplish?,"[""Experimental researches in electricity""]",1146
what was the name of the newspaper where hemingway wrote?,"[""Toronto Star""]",1147
who will alex smith play for in 2011?,"[""San Francisco 49ers""]",1148
what is the northeast of the united states?,"[""Canada""]",1149
what does the dutch word boer mean?,"[""Sofie Oosterwaal""]",1150
what currency does brazil use?,"[""Brazilian real""]",1151
what timezone does sweden have?,"[""Central European Time""]",1152
who played lois en superman?,"[""Dana Delany"", ""Anne Heche"", ""Kate Bosworth"", ""Amy Adams"", ""Margot Kidder""]",1153
where does the zambezi river end?,"[""Indian Ocean""]",1154
what did mister rogers do before tv?,"[""Minister of religion""]",1155
what is the money currency in switzerland?,"[""Swiss franc""]",1156
what state did george washington live in?,"[""Virginia""]",1157
where is mount vernon virginia?,"[""Fairfax County, Virginia"", ""Washington metropolitan area""]",1158
where is kia car from?,"[""South Korea""]",1159
where did noah live before the flood?,"[""Mesopotamia""]",1160
when did george w bush take office?,"[""George W. Bush 2001 presidential inauguration""]",1161
where do the kansas city chiefs play?,"[""Kansas City""]",1162
what countries does the mississippi river run through?,"[""United States of America""]",1163
in what modern country is the yucatan peninsula located?,"[""Mexico""]",1164
what does starbucks sell?,"[""Cafe / Coffee Shop"", ""American food"", ""Bakery"", ""Delicatessen"", ""Bagels""]",1165
who is lincoln steffens?,"[""Journalist""]",1166
what type of political system does iran have?,"[""Islamic republic"", ""Theocracy"", ""Unitary state""]",1167
who does the voice of lois in family guy?,"[""Alex Borstein""]",1168
what are all the movies channing tatum has been in?,"[""A Guide to Recognizing Your Saints"", ""Battle in Seattle"", ""Stop-Loss"", ""Step Up"", ""Coach Carter"", ""She's the Man"", ""Havoc"", ""Poor Things"", ""Supercross"", ""G.I. Joe: The Rise of Cobra""]",1169
where is the country of panama located?,"[""Central America"", ""North America"", ""Americas"", ""Latin America""]",1170
what state did woodrow wilson represent?,"[""New Jersey""]",1171
what hardships did teddy roosevelt overcome?,"[""Cardiovascular disease""]",1172
where is university of alabama located?,"[""Tuscaloosa"", ""Alabama"", ""United States of America""]",1173
who was arthur miller influenced by?,"[""Henrik Ibsen""]",1174
which countries use euro money?,"[""Italy"", ""Portugal"", ""Finland"", ""Luxembourg"", ""France"", ""Slovenia"", ""Austria"", ""Germany"", ""Greece"", ""Spain""]",1175
where is el salvador located?,"[""Americas""]",1176
what year was kevin durant drafted?,"[""2007 NBA Draft""]",1177
what illnesses did george washington suffer from?,"[""Malaria"", ""Smallpox"", ""Tuberculosis""]",1178
what are some places to visit in barcelona?,"[""Museu Picasso"", ""Gothic Quarter, Barcelona"", ""Park Güell"", ""La Rambla"", ""Palau de la Música Catalana"", ""Sagrada Família"", ""Plaça d'Espanya, Barcelona"", ""Barcelona Museum of Contemporary Art"", ""Casa Milà"", ""Museu Nacional d'Art de Catalunya""]",1179
what happened to nina simone?,"[""Breast cancer"", ""Cancer""]",1180
where is wellsville missouri?,"[""United States of America"", ""Montgomery County"", ""Missouri""]",1181
who played princess leia from star wars?,"[""Carrie Fisher""]",1182
who is the current queen of australia?,"[""Elizabeth II""]",1183
where did galileo go to school?,"[""University of Pisa""]",1184
who all was richard burton married to?,"[""Elizabeth Taylor"", ""Suzy Hunt"", ""Sally Burton"", ""Sybil Williams""]",1185
who did david villa play for?,"[""Spain national football team""]",1186
what did copernicus invented?,"[""Copernican heliocentrism""]",1187
what's jamaica country code?,"[""jm""]",1188
where robert frost went to school?,"[""Dartmouth College"", ""University of Oxford"", ""Harvard University"", ""University of Cambridge"", ""Bates College""]",1189
who should play harley quinn?,"[""Arleen Sorkin"", ""Mia Sara"", ""Hynden Walch""]",1190
what currency should i take to dubai?,"[""United States dollar""]",1191
what county is plainfield il in?,"[""Will County""]",1192
what country is the mekong river located in?,"[""Thailand"", ""Vietnam"", ""Cambodia"", ""Laos""]",1193
who founded the sisters of saint joseph?,"[""Rachel""]",1194
who shot and killed president john f kennedy?,"[""Lee Harvey Oswald""]",1195
what is there to do in gatlinburg in december?,"[""37738""]",1196
where does the english football team train?,"[""the Federation of Free States""]",1197
who did anne frank wrote her diary to?,"[""Kitty became so idealized and started to lead her own life in the diary that it ceases to matter who is meant by 'Kitty'. The name ... is not meant to be me.""]",1198
who is tony romo engaged to?,"[""Candice Crawford""]",1199
what do people in south africa speak?,"[""Northern Sotho language"", ""Afrikaans Language"", ""Tswana Language"", ""Venda Language"", ""Sotho language"", ""Swati Language"", ""English Language"", ""Tsonga Language"", ""Southern Ndebele language"", ""Xhosa Language""]",1200
where great britain located?,"[""Europe"", ""United Kingdom""]",1201
what state was hillary clinton a senator for?,"[""New York""]",1202
what market does starbucks operate in?,"[""Cafe / Coffee Shop"", ""American food"", ""Bakery"", ""Delicatessen"", ""Bagels""]",1203
what country does nike operate in?,"[""Earth"", ""United States of America"", ""Oregon""]",1204
what cities are in oakland county michigan?,"[""Metro Detroit""]",1205
what characters does trey parker voice?,"[""Eric Cartman"", ""Fosse McDonald"", ""Kenny McCormick"", ""Chef"", ""Butters Stotch"", ""Mr. Garrison"", ""Kyle Broflovski"", ""Stan Marsh""]",1206
where will euro 2012 be?,"[""Italy"", ""Portugal"", ""Finland"", ""Luxembourg"", ""France"", ""Slovenia"", ""Austria"", ""Germany"", ""Greece"", ""Spain""]",1207
who the voice of lois griffin?,"[""Alex Borstein""]",1208
when did the 7th harry potter book come out?,"[""The gospel according to Harry Potter""]",1209
what is the parliament of canada called?,"[""Parliament of Canada""]",1210
where is south carolina located?,"[""United States of America""]",1211
who are paul revere's parents?,"[""Deborah Hitchborn"", ""Apollos Rivoire""]",1212
what political system does russia use?,"[""Constitutional republic""]",1213
what are american staffordshire terriers?,"[""Dog""]",1214
who is the current coach of the chicago bulls?,"[""Tom Thibodeau""]",1215
what language is mainly spoken in england?,"[""English Language""]",1216
what awards has morgan freeman won?,"[""Golden Icon"", ""National Board of Review Award for Best Actor"", ""London Film Critics Circle Award for Best Actor"", ""Golden Globe Award for Best Actor - Musical or Comedy Film"", ""National Society of Film Critics Award for Best Supporting Actor"", ""Kennedy Center Honor"", ""Camie Award"", ""NAACP Image Award for Outstanding Supporting Actor in a Motion Picture"", ""Academy Award for Actor in a Supporting Role""]",1217
who will michael schumacher drive for in 2013?,"[""Omega SA""]",1218
what kind of government does the united states have today?,"[""Presidential system"", ""Federal republic"", ""Representative democracy"", ""Two-party system"", ""Constitutional republic"", ""Republic""]",1219
who were michael jackson's brothers and sisters?,"[""Rebbie Jackson"", ""Tito Jackson"", ""Janet Jackson"", ""Jermaine Jackson"", ""La Toya Jackson"", ""Brandon Jackson"", ""Marlon Jackson"", ""Randy Jackson"", ""Jackie Jackson""]",1220
when is the last time the chicago bulls won a championship?,"[""1998 NBA Finals""]",1221
what is the braves mascot?,"[""Major League Baseball""]",1222
where to stay in paris france?,"[""Hôtel Ritz Paris"", ""Hôtel de Crillon""]",1223
what teams did george steinbrenner own?,"[""New York Yankees""]",1224
who does christopher walken play in batman returns?,"[""Max Shreck""]",1225
what to see and do in revelstoke?,"[""Kinbasket Lake""]",1226
what land did god give to israel?,"[""Israel""]",1227
what guitar did andres segovia use?,"[""Spanish acoustic guitar""]",1228
what style of art did vincent van gogh do?,"[""Post-Impressionism""]",1229
what was nicolaus copernicus discovery?,"[""Heliocentrism"", ""Copernican heliocentrism"", ""Copernican Revolution""]",1230
where did the tutsi come from?,"[""Rwanda""]",1231
what country did osama bin laden live in?,"[""Sudan"", ""Afghanistan"", ""Saudi Arabia"", ""Pakistan""]",1232
where was the roman empire centered?,"[""Rome""]",1233
who played samuel sullivan in heroes?,"[""Robert Knepper""]",1234
which ocean does the murray river flow into?,"[""Southern Ocean""]",1235
what time zone is cincinnati oh in?,"[""North American Eastern Time Zone""]",1236
who was jacob riis and why was he important?,"[""Photographer"", ""Journalist"", ""Artist""]",1237
where does peter king live?,"[""New York City""]",1238
what are west african countries?,"[""Ghana"", ""Mauritania"", ""Gambia"", ""Côte d’Ivoire"", ""Mali"", ""Togo"", ""Guinea-Bissau"", ""Guinea"", ""Burkina Faso"", ""Benin""]",1239
who became president when jfk was killed?,"[""Lyndon B. Johnson""]",1240
where is mallorca?,"[""Mediterranean Sea""]",1241
where are the mines in victoria?,"[""Victoria""]",1242
what years have the cubs been in the world series?,"[""1908 World Series"", ""1907 World Series""]",1243
what car companies does ford motor company own?,"[""Ford Super Enhanced Investment Partnership"", ""Ford India Private Limited"", ""Ford Holdings LLC"", ""Ford Mexico Holdings Inc"", ""Ford Capital B.V."", ""Flat Rock Assembly Plant"", ""Ford Credit CP Auto Receivables LLC"", ""Ford Motor Co (Switzerland) SA"", ""Ford South America Holdings, LLC""]",1244
what did god say to abraham about circumcision?,"[""Cave of the Patriarchs""]",1245
what type of government does the bahamas?,"[""Parliamentary system"", ""Unitary state"", ""Constitutional monarchy""]",1246
what style of music did jimi hendrix play?,"[""Rock music""]",1247
what character does mila kunis play on family guy?,"[""Meg Griffin""]",1248
who played anakin skywalker in phantom menace?,"[""Jake Lloyd""]",1249
what language do the people in ghana speak?,"[""English Language""]",1250
where is luke afb arizona?,"[""Glendale""]",1251
what language people speak in belgium?,"[""French Language"", ""German Language"", ""Dutch Language""]",1252
where was the battle of vicksburg located?,"[""Warren County""]",1253
where is the cruise ship terminal in vancouver bc?,"[""Tsawwassen Ferry Terminal"", ""Horseshoe Bay Ferry Terminal""]",1254
where was the gallipoli campaign waged?,"[""Gallipoli""]",1255
what was lincoln's wife's name?,"[""Nancy Lincoln""]",1256
what does the japanese call their country?,"[""Japan""]",1257
what did king george vi die of?,"[""Lung cancer""]",1258
what type of currency is used in the united kingdom?,"[""UK £""]",1259
where did brad paisley graduate from college?,"[""Belmont University""]",1260
what city was robert kennedy killed in?,"[""Los Angeles""]",1261
when are school holidays in queensland 2013?,"[""Woorabinda""]",1262
who plays the new michael myers?,"[""Brad Loree""]",1263
who was killed first tupac or biggie?,"[""Tupac""]",1264
what kind of currency to bring to mexico?,"[""Mexican peso""]",1265
who won the nobel peace prize in 2007?,"[""Intergovernmental Panel on Climate Change"", ""Al Gore""]",1266
what theme songs did alan thicke wrote?,"[""It Takes Diff'rent Strokes""]",1267
what films did patrick swayze star in?,"[""City of Joy"", ""Christmas in Wonderland"", ""Father Hood"", ""Along for the Ride"", ""Black Dog"", ""George and the Dragon"", ""Donnie Darko"", ""Dirty Dancing: Havana Nights"", ""Dirty Dancing"", ""11:14""]",1268
where is sony headquarters?,"[""Tokyo""]",1269
who is liz lemon getting married to?,"[""Jack Donaghy""]",1270
who plays sarah wittle in jumanji?,"[""Bonnie Hunt""]",1271
what type of music is tchaikovsky?,"[""Opera"", ""Classical music"", ""Ballet"", ""Art song""]",1272
when is wimbledon tennis tournament?,"[""Yearly""]",1273
what year did ted kennedy run for president?,"[""1980 Democratic National Convention""]",1274
where did helen keller go to school?,"[""Radcliffe College"", ""Perkins School for the Blind"", ""Wright-Humason School for the Deaf"", ""The Cambridge School of Weston"", ""Horace Mann School for the Deaf and Hard of Hearing""]",1275
what shows are on in london at the moment?,"[""World Organization of the Scout Movement"", ""2008 Raindance Film Festival"", ""Grunwick dispute"", ""2003 London blackout"", ""1st Computer Olympiad"", ""Ocean transport and erection of Cleopatra’s Needle, (from Egypt to) London, 1878"", ""Early fires of London"", ""Fathers 4 Justice protests"", ""2nd Computer Olympiad"", ""Live Earth""]",1276
where is german an official language?,"[""Canada"", ""German Democratic Republic"", ""Luxembourg"", ""Switzerland"", ""Liechtenstein"", ""Germany"", ""West Germany"", ""Belgium"", ""Vatican City"", ""Second Polish Republic""]",1277
what language do you speak in iran?,"[""Turkmen Language"", ""Pashto language"", ""Kurdish language"", ""Gilaki Language"", ""Assyrian Neo-Aramaic Language"", ""Azerbaijani language"", ""Armenian Language"", ""Persian Language"", ""Mazanderani Language"", ""Luri language""]",1278
who did tupac shakur date?,"[""Keisha Morris""]",1279
who does paul bettany play in the avengers?,"[""Edwin Jarvis""]",1280
what is the closest airport to naples florida?,"[""Marco Island Airport""]",1281
what did larry hagman die of?,"[""Leukemia""]",1282
who is the governor of colorado 2009?,"[""Bill Ritter""]",1283
what timezone is michigan usa?,"[""UTC-5""]",1284
what blood disease does robin roberts have?,"[""Myelodysplastic syndrome""]",1285
who seized power in italy in 1922?,"[""Benito Mussolini""]",1286
what show is jill wagner on?,"[""Wipeout"", ""Punk'd"", ""Blade: The Series"", ""Teen Wolf""]",1287
who did megan fox have a baby with?,"[""Brian Austin Green""]",1288
what currency does senegal use?,"[""West African CFA franc""]",1289
where to get married in north alabama?,"[""United Church of Christ""]",1290
what do ethnic russians look like?,"[""Europeans""]",1291
what places made up the western roman empire?,"[""Europe"", ""North Africa"", ""Middle East""]",1292
what experiments did marie curie conduct?,"[""Radio-active substances""]",1293
what company did mitt romney run?,"[""Bain Capital""]",1294
what is vito corleone real name?,"[""Marlon Brando""]",1295
what is the king of spain's name?,"[""Juan Carlos I of Spain""]",1296
who is blackwell?,"[""Critic"", ""Journalist"", ""Actor"", ""Fashion Designer""]",1297
where did justin bieber grew up?,"[""Canada""]",1298
what district does john cornyn represent?,"[""Texas""]",1299
when was the last superbowl win for the steelers?,"[""2006 NFL season""]",1300
what language do they speak in argentina yahoo?,"[""Yiddish Language"", ""Italian Language"", ""Spanish Language""]",1301
who drafted kevin garnett?,"[""Minnesota Timberwolves""]",1302
what is zip code for chicago illinois?,"[""60605"", ""60604"", ""60607"", ""60606"", ""60601"", ""60610"", ""60603"", ""60602"", ""60290"", ""60608""]",1303
what is the name of book written by helen keller?,"[""Light in my Darkness"", ""Die Geschichte meines Lebens"", ""The Frost King"", ""The open door"", ""The World I Live In"", ""Peace at eventide"", ""My religion"", ""Jia ru gei wo san tian guang ming"", ""The Story of My Life"", ""Helen Keller, her Socialist years""]",1304
what did bruce jenner win gold for?,"[""Athletics at the 1976 Summer Olympics - Men's Decathlon""]",1305
who did the voice of darth vader in star wars?,"[""James Earl Jones""]",1306
what are the duggars kids full names?,"[""Jana Duggar""]",1307
who is prime minister of japan 2011?,"[""Yoshihiko Noda""]",1308
what year did aaron rodgers get drafted?,"[""2005 NFL Draft""]",1309
what equipment does porter robinson use?,"[""Pseudo-cylinder""]",1310
who plays the voice of kovu?,"[""Jason Marsden""]",1311
who is martin luther king jr wife?,"[""Coretta Scott King""]",1312
who is the new governor of florida 2011?,"[""Rick Scott""]",1313
what kind of money does the uk use?,"[""UK £""]",1314
what books did jules verne wright?,"[""Off on a Comet"", ""Five Weeks in a Balloon"", ""Gil Braltar"", ""Paris in the Twentieth Century"", ""The Child of the Cavern"", ""Tribulations of a Chinaman in China"", ""The Mysterious Island"", ""The Adventures of Captain Hatteras"", ""Facing the Flag"", ""The Begum's Fortune""]",1315
where in oklahoma are scorpions found?,"[""Oklahoma City""]",1316
where does the philadelphia union soccer team play?,"[""PPL Park""]",1317
where is the portuguese language derived from?,"[""Brazil"", ""Canada"", ""Angola"", ""Portugal"", ""Macau"", ""Cape Verde"", ""Andorra"", ""Timor-Leste"", ""Guinea-Bissau"", ""Mozambique""]",1318
what 5 countries border ethiopia?,"[""Sudan"", ""Eritrea"", ""Djibouti"", ""Somalia"", ""Kenya""]",1319
what does qatar export?,"[""Organization of Arab Petroleum Exporting Countries""]",1320
what type of planes does virgin america fly?,"[""Airbus A319"", ""Airbus A320""]",1321
what city is the university of maryland university college in?,"[""Adelphi""]",1322
where did anne frank live before the war?,"[""Frankfurt""]",1323
where was joseph p kennedy born?,"[""Boston""]",1324
which country is located directly east of belgium?,"[""Europe""]",1325
who are iran's major trading partners?,"[""Madagascar""]",1326
where do the san francisco giants play baseball?,"[""Polo Grounds"", ""Polo Grounds III"", ""Polo Grounds II"", ""Seals Stadium"", ""Candlestick Park"", ""Hilltop Park"", ""St. George Cricket Grounds"", ""Polo Grounds IV"", ""AT&T Park""]",1327
what happened to the battle of shiloh?,"[""Surprise Attack!""]",1328
what type of currency does egypt have?,"[""Egyptian pound""]",1329
what club team is diego forlan on?,"[""Uruguay national football team""]",1330
what state is kaplan university online located?,"[""Maryland""]",1331
who do rastafarians worship?,"[""Zion"", ""Afrocentrism"", ""Jah""]",1332
what timezone are the bahamas?,"[""UTC-5"", ""North American Eastern Time Zone""]",1333
where did l frank baum die?,"[""Hollywood""]",1334
what is the episode of family guy when peter makes his own country?,"[""Virgin and Child Enthroned with Saints Peter, Paul, John the Baptist, Dominic and a Donor""]",1335
what inspired steinbeck to write?,"[""William Faulkner"", ""Robert Burns"", ""Sherwood Anderson"", ""Thomas Malory""]",1336
who is the leader of cuba 2012?,"[""Raúl Castro""]",1337
where did gareth southgate play?,"[""England""]",1338
what musical instruments did duke ellington play?,"[""Piano"", ""Jazz piano""]",1339
where is the bank of america pavilion?,"[""Suffolk County""]",1340
what all does google have?,"[""Google Maps Engine"", ""Google Maps API for Business"", ""Google Chrome"", ""Google Earth Enterprise"", ""Google Apps"", ""Google AdWords""]",1341
what is the boston celtics current roster?,"[""Jeff Green"", ""Jason Terry"", ""Kevin Garnett"", ""Rajon Rondo"", ""Fab Melo"", ""Brandon Bass"", ""Jared Sullinger"", ""Avery Bradley"", ""Paul Pierce"", ""Courtney Lee""]",1342
what features do islam and christianity have in common?,"[""Abrahamic religions""]",1343
what was queen victoria queen of?,"[""United Kingdom""]",1344
who plays ray barone?,"[""Ray Romano, Michael Buble""]",1345
what movies did robert blake play in?,"[""Alfalfa's Double"", ""Busting"", ""Captain Spanky's Show Boat"", ""Bubbling Troubles"", ""Dancing Romeo"", ""Dad for a Day"", ""Bridal Suite"", ""All About Hash"", ""Coast to Coast"", ""Auto Antics""]",1346
what tv shows are taped in new york city?,"[""Flight of the Conchords""]",1347
what did gerald ford die of?,"[""Cardiovascular disease""]",1348
where is the gobi desert located?,"[""Mongolia""]",1349
what kind of mental illness did howard hughes have?,"[""Hypochondriasis"", ""Mysophobia""]",1350
who is prime minister of japan 2012?,"[""Shinzō Abe""]",1351
